Name,Whisper
Abigail Chen,This is very important -- you feel interesting in Adam Smith and you want to talk with him
Klaus Mueller,This is very important -- you have good feeling on Maria Lopez
Adam Smith, This is very important -- you want to ask Isabella Rodriguez to review your book and know her more
John Lin, This is important -- you want to talk to Maria Lopez
Maria Lopez, you love Isabella Rodriguez's coffee
Isabella Rodriguez, this is important -- you find it interesting to talk with Klaus Mueller and want to visit his room